{"all_passed":true,"artifacts":[{"bytes":424,"path":"cleanup.json","sha256":"cd0e47cc6be6fe2c1fbcb25cea0b72c672c112b53360234f9d169e7d2e19ec19"},{"bytes":166366,"path":"command-audit.jsonl","sha256":"d4d5fe319f81b13a2ad117e61eef0bce85a8ba30cd3fe033ee4e29ce3e5543e8"},{"bytes":1668,"path":"environment/properties-fixed.txt","sha256":"359fc94bbe492ac4c907cdf253a90819004142697cce5574b8c5d185f4ace980"},{"bytes":987,"path":"environment/properties-variable.txt","sha256":"2f222f1943826466d6f9170b571f0bb1ae137cc83267391f4352ac9d302f9601"},{"bytes":614,"path":"environment.json","sha256":"f9b342c4ea67734b233cf2479744144139ca29801c81bcebd56ebfea71bb145d"},{"bytes":13728,"path":"mutation-results.jsonl","sha256":"c66f123517eac754048f4ab69178af1dfb601686b65096e5732d20beaeaf6933"},{"bytes":34,"path":"public/ak.name","sha256":"d8090eb9d72fe41d4ae4b527cb9868a94eadd684c005488d6411c9a6e7d37049"},{"bytes":451,"path":"public/ak.pem","sha256":"791bd4c680ec819a613babfe6270f0054fd93dd8583e9990efd5d321a2a9364c"},{"bytes":282,"path":"public/ak.pub","sha256":"ce2553eebb6b2daa980f4193dd85c0258a584411089fe414e5cd92986cb8694c"},{"bytes":34,"path":"public/transient-primary.name","sha256":"3ed25b974ee979fd198d325d120de2714aa8cf81814740c1989007559ff6ee10"},{"bytes":451,"path":"public/transient-primary.pem","sha256":"ff82ca8b5972111a2f8d0e4022e61e164ef3bbc3f78e51b739e7324cad143da8"},{"bytes":284,"path":"public/transient-primary.pub","sha256":"3dc2705dbe3747c78764e5127839cc055295f0be74693319c4a207a3b37229c1"},{"bytes":245,"path":"summary.json","sha256":"5ef50ec566571382eb15eea08b55c6e1e6a14b312ed15449adce649f643ac54b"},{"bytes":325856,"path":"vectors.jsonl","sha256":"dd5ffcd5f7e72d99090d430a72e204f5800afaa34874b7d0b93fd923499b240d"}],"claim_boundary":"104 transaction-bound quotes under one transient AK at the current selected PCR state; the TPM class and virtualization boundary must be established by the adjacent host provenance; no manufacturer-certified EK, secure application measurement, trusted time, or physical-host identity claim","cleanup":{"ak_flush_attempted":true,"cleanup_verified":true,"handle_census_returncodes":{"persistent":0,"transient":0},"nv_writes":0,"pcr_writes":0,"persistent_handles_after":0,"persistent_handles_before":0,"persistent_handles_created":0,"primary_flush_attempted":true,"private_state_files_exported":0,"run_transient_handles_remaining":0,"transient_handles_after":0,"transient_handles_before":0},"configuration":{"ak_algorithm":"rsa","ak_creation_profile":"create-load","hash_algorithm":"sha256","pcr_bank":"sha256","pcr_index":16,"primary_algorithm":"rsa","primary_hierarchy":"owner","qualifying_data_profile":"subject-bound.hardware-quote.v1","tcti_kind":"device","tcti_sha256":"0181b4b30edd2aa21e086c50ea7398f44c35f18043ba770fd3f95d9ad23f2f62"},"counts":{"baseline_quotes":104,"baseline_verified":104,"mutation_cases":64,"mutation_rejections":64,"unique_challenges":104,"unique_qualifying_data":104,"unique_transactions":104},"environment":{"hostname_sha256":"a63ebc85bf68d4510c75c94f8651413cec6ab515ac1d6172e3190551294beb6c","kernel":"6.17.0-35-generic","machine":"x86_64","platform":"Linux-6.17.0-35-generic-x86_64-with-glibc2.39","properties_fixed_sha256":"359fc94bbe492ac4c907cdf253a90819004142697cce5574b8c5d185f4ace980","properties_variable_sha256":"2f222f1943826466d6f9170b571f0bb1ae137cc83267391f4352ac9d302f9601","python":"3.12.3","tcti_kind":"device","tcti_sha256":"0181b4b30edd2aa21e086c50ea7398f44c35f18043ba770fd3f95d9ad23f2f62","tpm2_tools":"tool=\"/usr/bin/tpm2_quote\" version=\"5.6\" tctis=\"libtss2-tctildr\" tcti-default=tcti-device"},"public_provenance":{"ak_name_sha256":"d8090eb9d72fe41d4ae4b527cb9868a94eadd684c005488d6411c9a6e7d37049","ak_public_sha256":"ce2553eebb6b2daa980f4193dd85c0258a584411089fe414e5cd92986cb8694c","manufacturer_certificate_present":false,"transient_primary_name_sha256":"3ed25b974ee979fd198d325d120de2714aa8cf81814740c1989007559ff6ee10","transient_primary_public_sha256":"3dc2705dbe3747c78764e5127839cc055295f0be74693319c4a207a3b37229c1"},"run_status":"tpm-executed","schema":"subject-bound-tpm-run-manifest-v2","source":{"capsule_sha256":"8c8919f9826381da289b73dfd35721938ad5aafea5cd3687b23187589a2d0386","corpus_path":"masters-thesis-radar/research-factory-v4-2026-07-27/labs/composed-transaction-corpus/corpus.json","corpus_sha256":"1ba6d40d07e62a862b98ec52ab5c189eb491f19e4e1e69a411fba73bbb9a43a8","transactions":104}}
